{
 "accessed": "2026-09-26",
 "boundary_version": "bus_power_boundary_v1",
 "components": {
  "cathode_heater": {
   "efficiency_evidence": [],
   "efficiency_status": "TBD",
   "entries": [
    {
     "applicability": {
      "notes": "steady-mode ledger: heater 0 W with efficiency 1.0 (explicit) if the cathode self-heats; the start-up mode carries the heater load"
     },
     "chain_stage": "load plane",
     "derivation": null,
     "evidence_class": "qualitative",
     "evidence_level": 5,
     "id": "CH-G&K-STEADY-OFF",
     "locator": "Sec. 7.2.3, p. 337",
     "quantity": "heater use in steady Hall operation",
     "reporting": "textbook-typical",
     "role": "load-bracket",
     "source_ids": [
      "S-GOEBEL08"
     ],
     "tbd_requires": null,
     "transformation_chain": "textbook statement -> quoted",
     "uncertainty": "design-specific",
     "units": null,
     "validation_status": "general practice",
     "value": "'the cathode heater is turned off once the discharge supply is turned on, and the cathode runs in a self-heating mode'",
     "value_kind": "qualitative"
    },
    {
     "applicability": {
      "gas": "Xe",
      "notes": "0.4-0.8 mg/s Xe at ignition"
     },
     "chain_stage": "load plane (start-up mode)",
     "derivation": null,
     "evidence_class": "measured",
     "evidence_level": 3,
     "id": "CH-PEDRINI17-HC3",
     "locator": "Sec. V ('a heater power of about 60 W allowed for ignitions at keeper voltages lower than 300 V')",
     "quantity": "ignition heater power, LaB6 HC3 (1-3 A class, first-generation heater)",
     "reporting": "measurement",
     "role": "load-bracket",
     "source_ids": [
      "S-PEDRINI17"
     ],
     "tbd_requires": null,
     "transformation_chain": "measurement -> text -> transcribed",
     "uncertainty": "'about'",
     "units": "W",
     "validation_status": "> 60 ignitions on xenon",
     "value": 60.0,
     "value_kind": "number"
    },
    {
     "applicability": {
      "gas": "Xe",
      "notes": "current class below target (level 6)"
     },
     "chain_stage": "load plane (start-up mode)",
     "derivation": null,
     "evidence_class": "measured",
     "evidence_level": 6,
     "id": "CH-PEDRINI17-HC1",
     "locator": "Sec. IV.A-B ('about 45 W'; emitter ~1460 K in about 600 s; 120 ignitions)",
     "quantity": "ignition heater power, LaB6 HC1 (0.3-1 A class)",
     "reporting": "measurement",
     "role": "load-bracket",
     "source_ids": [
      "S-PEDRINI17"
     ],
     "tbd_requires": null,
     "transformation_chain": "measurement -> text -> transcribed",
     "uncertainty": "'about'",
     "units": "W",
     "validation_status": "120-ignition test",
     "value": 45.0,
     "value_kind": "number"
    },
    {
     "applicability": {
      "gas": "Xe",
      "notes": "shows the design spread of heater power (45-305 W across three LaB6 designs); keeper ignition 550-850 V"
     },
     "chain_stage": "load plane (start-up mode)",
     "derivation": null,
     "evidence_class": "measured",
     "evidence_level": 6,
     "id": "CH-MONTERO24",
     "locator": "Sec. V.A and Table 8 ('the HC ignites within 10 - 15 sccm, consuming 267 - 305 W of heating power')",
     "quantity": "ignition heating power, sub-1 A LaB6 cathode (UC3M)",
     "reporting": "measurement",
     "role": "load-bracket",
     "source_ids": [
      "S-MONTERO24"
     ],
     "tbd_requires": null,
     "transformation_chain": "measurement -> text/table -> transcribed",
     "uncertainty": "steady state never reached during ignition (source)",
     "units": "W",
     "validation_status": "> 5 xenon ignitions; self-sustained afterwards with heater off and keeper floating",
     "value": {
      "max": 305.0,
      "min": 267.0
     },
     "value_kind": "range"
    },
    {
     "applicability": {
      "notes": "Rhodes 2024 slide 3 rating only: 24-34 V in, 1-8 A, 1-12 V, 80 W max"
     },
     "chain_stage": "bus input terminal -> load plane",
     "derivation": null,
     "evidence_class": "tbd",
     "evidence_level": null,
     "id": "CH-SUPPLY-EFF",
     "locator": "slide 3",
     "quantity": "heater-supply efficiency at the operating point",
     "reporting": "none",
     "role": "efficiency-candidate",
     "source_ids": [
      "S-RHODES24"
     ],
     "tbd_requires": "a measured heater-supply efficiency at the heater current/voltage of the selected cathode",
     "transformation_chain": "none (no usable value accessed)",
     "uncertainty": "not quantifiable",
     "units": null,
     "validation_status": "not applicable",
     "value": null,
     "value_kind": "tbd"
    }
   ],
   "in_architectures": [
    "hall_only",
    "rf_hall",
    "ecr_hall"
   ],
   "load_plane": "heater terminals (evaluated mode)",
   "load_status": "brackets-only (start-up mode); 0 W in steady mode if self-heating"
  },
  "cathode_keeper": {
   "efficiency_evidence": [],
   "efficiency_status": "TBD",
   "entries": [
    {
     "applicability": {
      "notes": "a steady keeper may be kept on for stability or contamination margin in an ABEP background (cathode lane decision); then its load is TBD"
     },
     "chain_stage": "load plane",
     "derivation": null,
     "evidence_class": "qualitative",
     "evidence_level": 5,
     "id": "CK-G&K-OFF",
     "locator": "Sec. 7.2.3, p. 337",
     "quantity": "keeper use in Hall thrusters (steady state)",
     "reporting": "textbook-typical",
     "role": "load-bracket",
     "source_ids": [
      "S-GOEBEL08"
     ],
     "tbd_requires": null,
     "transformation_chain": "textbook statement -> quoted",
     "uncertainty": "'normally': design-specific",
     "units": null,
     "validation_status": "general practice, not Vyovrinda",
     "value": "'The keeper is also normally used only during start-up and is turned off once the thruster is ignited.'",
     "value_kind": "qualitative"
    },
    {
     "applicability": {
      "cathode_current_A": "keeper-only; cathode class 1-3 A (diode 2.5-4 A)",
      "gas": "Xe",
      "notes": "upper bracket for a keeper used as the sustaining anode (start-up, dark channel)"
     },
     "chain_stage": "load plane",
     "derivation": null,
     "evidence_class": "measured",
     "evidence_level": 3,
     "id": "CK-PEDRINI17-HC3",
     "locator": "Sec. V ('the discharge power ranges from about 25 to 60 W, corresponding to a discharge voltage settling in the range 14 - 35 V'), Fig. 11a",
     "quantity": "keeper-discharge power, LaB6 cathode HC3 (1-3 A class) operated with the keeper as the only anode",
     "reporting": "measurement",
     "role": "load-bracket",
     "source_ids": [
      "S-PEDRINI17"
     ],
     "tbd_requires": null,
     "transformation_chain": "measurement -> text -> transcribed",
     "uncertainty": "'about'; per-point values only in Fig. 11a (not digitized)",
     "units": "W",
     "validation_status": "stand-alone cathode test on xenon; keeper-only mode, not keeper power with a thruster running",
     "value": {
      "max": 60.0,
      "min": 25.0
     },
     "value_kind": "range"
    },
    {
     "applicability": {
      "gas": "Xe",
      "notes": "current class below a 1.5 kW Hall cathode (extrapolation, level 6)"
     },
     "chain_stage": "load plane",
     "derivation": null,
     "evidence_class": "measured",
     "evidence_level": 6,
     "id": "CK-PEDRINI17-HC1",
     "locator": "Sec. IV.B ('The power consumption of HC1 settles in the range from 9 to 20 W'), Fig. 8a",
     "quantity": "keeper-discharge power, LaB6 cathode HC1 (0.3-1 A class) with keeper only",
     "reporting": "measurement",
     "role": "load-bracket",
     "source_ids": [
      "S-PEDRINI17"
     ],
     "tbd_requires": null,
     "transformation_chain": "measurement -> text -> transcribed",
     "uncertainty": "range as stated",
     "units": "W",
     "validation_status": "stand-alone; coupled to HT100 with the keeper floating; 350 h with MSHT100 at 0.5 A keeper current (keeper power not stated)",
     "value": {
      "max": 20.0,
      "min": 9.0
     },
     "value_kind": "range"
    },
    {
     "applicability": {
      "notes": "Rhodes 2024 slide 3 rating only: flyback keeper supply, 24-34 V in, 0.5-1 A, 5-40 V, 25 W max, DC-ramp ignition up to 300 V open circuit (slide 10)"
     },
     "chain_stage": "bus input terminal -> load plane",
     "derivation": null,
     "evidence_class": "tbd",
     "evidence_level": null,
     "id": "CK-SUPPLY-EFF",
     "locator": "slides 3 and 10",
     "quantity": "keeper-supply efficiency at the operating point",
     "reporting": "none",
     "role": "efficiency-candidate",
     "source_ids": [
      "S-RHODES24"
     ],
     "tbd_requires": "a measured keeper-supply efficiency at the keeper current/voltage used by the cathode policy",
     "transformation_chain": "none (no usable value accessed)",
     "uncertainty": "not quantifiable",
     "units": null,
     "validation_status": "not applicable",
     "value": null,
     "value_kind": "tbd"
    }
   ],
   "in_architectures": [
    "hall_only",
    "rf_hall",
    "ecr_hall"
   ],
   "load_plane": "keeper terminals",
   "load_status": "brackets-only (policy-dependent; 0 W if off in the mode)"
  },
  "compressor": {
   "efficiency_evidence": [],
   "efficiency_status": "TBD",
   "entries": [
    {
     "applicability": {
      "notes": "a model exists, so the load is computable once its inputs are sourced; the upstream flow comes from the intake/ICD and never from Hall-closure uncertainty"
     },
     "chain_stage": "load plane (motor-drive electrical input)",
     "derivation": null,
     "evidence_class": "model-derived",
     "evidence_level": 7,
     "id": "CP-REPO-MODEL",
     "locator": "abep_sim/compressor.py module docstring and _run_once (P_el = (P_gas + P_bear) / eta_motor + P_ctrl_W)",
     "quantity": "compressor motor-drive electrical input P_el",
     "reporting": "derivation",
     "role": "load-model",
     "source_ids": [
      "S-REPO"
     ],